{
  "schema_version": 1,
  "film_id": "smoke_test",
  "pipeline_stage": "ingestion",
  "status": "complete",
  "created_at": "2026-10-16T15:00:01.618959+00:00",
  "source_media": {
    "path": "C:\\Users\\shravani\\Documents\\GitHub\\PHONY_APP\\data\\media\\smoke_test.mp4",
    "filename": "smoke_test.mp4",
    "size_bytes": 276134947,
    "container_duration_seconds": 634.6,
    "format_name": "mov,mp4,m4a,3gp,3g2,mj2",
    "video_stream_count": 1,
    "audio_stream_count": 2
  },
  "normalized_video": {
    "path": "normalized.mp4",
    "codec": "h264",
    "pixel_format": "yuv420p",
    "width": 1920,
    "height": 1080,
    "fps": 24.0,
    "duration_seconds": 634.5,
    "frame_count": 15228,
    "timeline_start_seconds": 0.0
  },
  "audio": {
    "present": true,
    "extraction_status": "extracted",
    "path": "audio_mono_44100.wav",
    "codec": "pcm_s16le",
    "sample_rate": 44100,
    "channels": 1,
    "duration_seconds": 634.144014,
    "error": null
  },
  "low_res_frames": {
    "path": "low_res_frames_128x72.rgb",
    "width": 128,
    "height": 72,
    "pixel_format": "rgb24",
    "fps": 24.0,
    "frame_count": 15228,
    "storage_format": "raw_rgb24",
    "bytes_per_frame": 27648,
    "total_bytes": 421023744,
    "frame_loss_count": 0,
    "loss_policy": "strict_zero_loss"
  },
  "snapshots": {
    "output_dir": "snapshots",
    "manifest_path": "snapshots/frames_manifest.json",
    "snapshot_count": 635,
    "target_fps": 1.0,
    "max_dimension": 512,
    "format": "jpeg"
  },
  "warnings": [],
  "errors": []
}